[
  {
    "id": "pattern-repeated-questioning",
    "version": "0.2",
    "name": "边界表达后的反复追问",
    "definition": "识别“边界表达后的反复追问”时，只使用对话中的行为、次数、条件和后续反应，不把单次事件写成人格本质。",
    "observable_signals": [
      "对话出现与“边界表达后的反复追问”相关的明确行为",
      "用户或对方给出可核对的条件、次数或影响"
    ],
    "counterexamples": [
      "对方在得到新信息后停止或调整",
      "双方已明确同意相同规则且可以自由拒绝"
    ],
    "possible_user_impact": [
      "压力或困惑",
      "关系、时间、信用或安全成本"
    ],
    "strategy_refs": [
      "strategy-clarify-intent"
    ],
    "cautions": [
      "先核对上下文和反例",
      "区分事实、感受、推测与未知"
    ],
    "lens": "balanced",
    "risk_level": "none",
    "humor_applicability": "suitable",
    "source_note": "原创模式总结",
    "review_status": "pending_human_review"
  },
  {
    "id": "pattern-immediate-commitment",
    "version": "0.2",
    "name": "催促立即承诺",
    "definition": "识别“催促立即承诺”时，只使用对话中的行为、次数、条件和后续反应，不把单次事件写成人格本质。",
    "observable_signals": [
      "对话出现与“催促立即承诺”相关的明确行为",
      "用户或对方给出可核对的条件、次数或影响"
    ],
    "counterexamples": [
      "对方在得到新信息后停止或调整",
      "双方已明确同意相同规则且可以自由拒绝"
    ],
    "possible_user_impact": [
      "压力或困惑",
      "关系、时间、信用或安全成本"
    ],
    "strategy_refs": [
      "strategy-clarify-intent"
    ],
    "cautions": [
      "先核对上下文和反例",
      "区分事实、感受、推测与未知"
    ],
    "lens": "balanced",
    "risk_level": "none",
    "humor_applicability": "suitable",
    "source_note": "原创模式总结",
    "review_status": "pending_human_review"
  },
  {
    "id": "pattern-private-intrusion",
    "version": "0.2",
    "name": "越界索取私人信息",
    "definition": "识别“越界索取私人信息”时，只使用对话中的行为、次数、条件和后续反应，不把单次事件写成人格本质。",
    "observable_signals": [
      "对话出现与“越界索取私人信息”相关的明确行为",
      "用户或对方给出可核对的条件、次数或影响"
    ],
    "counterexamples": [
      "对方在得到新信息后停止或调整",
      "双方已明确同意相同规则且可以自由拒绝"
    ],
    "possible_user_impact": [
      "压力或困惑",
      "关系、时间、信用或安全成本"
    ],
    "strategy_refs": [
      "strategy-clarify-intent"
    ],
    "cautions": [
      "先核对上下文和反例",
      "区分事实、感受、推测与未知"
    ],
    "lens": "balanced",
    "risk_level": "none",
    "humor_applicability": "suitable",
    "source_note": "原创模式总结",
    "review_status": "pending_human_review"
  },
  {
    "id": "pattern-public-devaluation",
    "version": "0.2",
    "name": "公开贬低或贴标签",
    "definition": "识别“公开贬低或贴标签”时，只使用对话中的行为、次数、条件和后续反应，不把单次事件写成人格本质。",
    "observable_signals": [
      "对话出现与“公开贬低或贴标签”相关的明确行为",
      "用户或对方给出可核对的条件、次数或影响"
    ],
    "counterexamples": [
      "对方在得到新信息后停止或调整",
      "双方已明确同意相同规则且可以自由拒绝"
    ],
    "possible_user_impact": [
      "压力或困惑",
      "关系、时间、信用或安全成本"
    ],
    "strategy_refs": [
      "strategy-clarify-intent"
    ],
    "cautions": [
      "先核对上下文和反例",
      "区分事实、感受、推测与未知"
    ],
    "lens": "balanced",
    "risk_level": "none",
    "humor_applicability": "suitable",
    "source_note": "原创模式总结",
    "review_status": "pending_human_review"
  },
  {
    "id": "pattern-comparison-pressure",
    "version": "0.2",
    "name": "通过比较制造压力",
    "definition": "识别“通过比较制造压力”时，只使用对话中的行为、次数、条件和后续反应，不把单次事件写成人格本质。",
    "observable_signals": [
      "对话出现与“通过比较制造压力”相关的明确行为",
      "用户或对方给出可核对的条件、次数或影响"
    ],
    "counterexamples": [
      "对方在得到新信息后停止或调整",
      "双方已明确同意相同规则且可以自由拒绝"
    ],
    "possible_user_impact": [
      "压力或困惑",
      "关系、时间、信用或安全成本"
    ],
    "strategy_refs": [
      "strategy-clarify-intent"
    ],
    "cautions": [
      "先核对上下文和反例",
      "区分事实、感受、推测与未知"
    ],
    "lens": "balanced",
    "risk_level": "none",
    "humor_applicability": "suitable",
    "source_note": "原创模式总结",
    "review_status": "pending_human_review"
  },
  {
    "id": "pattern-decision-substitution",
    "version": "0.2",
    "name": "未经授权替他人决定",
    "definition": "识别“未经授权替他人决定”时，只使用对话中的行为、次数、条件和后续反应，不把单次事件写成人格本质。",
    "observable_signals": [
      "对话出现与“未经授权替他人决定”相关的明确行为",
      "用户或对方给出可核对的条件、次数或影响"
    ],
    "counterexamples": [
      "对方在得到新信息后停止或调整",
      "双方已明确同意相同规则且可以自由拒绝"
    ],
    "possible_user_impact": [
      "压力或困惑",
      "关系、时间、信用或安全成本"
    ],
    "strategy_refs": [
      "strategy-clarify-intent"
    ],
    "cautions": [
      "先核对上下文和反例",
      "区分事实、感受、推测与未知"
    ],
    "lens": "balanced",
    "risk_level": "none",
    "humor_applicability": "suitable",
    "source_note": "原创模式总结",
    "review_status": "pending_human_review"
  },
  {
    "id": "pattern-emotion-invalidation",
    "version": "0.2",
    "name": "否定感受而不谈事实",
    "definition": "识别“否定感受而不谈事实”时，只使用对话中的行为、次数、条件和后续反应，不把单次事件写成人格本质。",
    "observable_signals": [
      "对话出现与“否定感受而不谈事实”相关的明确行为",
      "用户或对方给出可核对的条件、次数或影响"
    ],
    "counterexamples": [
      "对方在得到新信息后停止或调整",
      "双方已明确同意相同规则且可以自由拒绝"
    ],
    "possible_user_impact": [
      "压力或困惑",
      "关系、时间、信用或安全成本"
    ],
    "strategy_refs": [
      "strategy-clarify-intent"
    ],
    "cautions": [
      "先核对上下文和反例",
      "区分事实、感受、推测与未知"
    ],
    "lens": "balanced",
    "risk_level": "none",
    "humor_applicability": "suitable",
    "source_note": "原创模式总结",
    "review_status": "pending_human_review"
  },
  {
    "id": "pattern-responsibility-shifting",
    "version": "0.2",
    "name": "转移或模糊责任",
    "definition": "识别“转移或模糊责任”时，只使用对话中的行为、次数、条件和后续反应，不把单次事件写成人格本质。",
    "observable_signals": [
      "对话出现与“转移或模糊责任”相关的明确行为",
      "用户或对方给出可核对的条件、次数或影响"
    ],
    "counterexamples": [
      "对方在得到新信息后停止或调整",
      "双方已明确同意相同规则且可以自由拒绝"
    ],
    "possible_user_impact": [
      "压力或困惑",
      "关系、时间、信用或安全成本"
    ],
    "strategy_refs": [
      "strategy-clarify-intent"
    ],
    "cautions": [
      "先核对上下文和反例",
      "区分事实、感受、推测与未知"
    ],
    "lens": "balanced",
    "risk_level": "none",
    "humor_applicability": "suitable",
    "source_note": "原创模式总结",
    "review_status": "pending_human_review"
  },
  {
    "id": "pattern-joke-offense",
    "version": "0.2",
    "name": "用玩笑包装冒犯",
    "definition": "识别“用玩笑包装冒犯”时，只使用对话中的行为、次数、条件和后续反应，不把单次事件写成人格本质。",
    "observable_signals": [
      "对话出现与“用玩笑包装冒犯”相关的明确行为",
      "用户或对方给出可核对的条件、次数或影响"
    ],
    "counterexamples": [
      "对方在得到新信息后停止或调整",
      "双方已明确同意相同规则且可以自由拒绝"
    ],
    "possible_user_impact": [
      "压力或困惑",
      "关系、时间、信用或安全成本"
    ],
    "strategy_refs": [
      "strategy-clarify-intent"
    ],
    "cautions": [
      "先核对上下文和反例",
      "区分事实、感受、推测与未知"
    ],
    "lens": "balanced",
    "risk_level": "none",
    "humor_applicability": "suitable",
    "source_note": "原创模式总结",
    "review_status": "pending_human_review"
  },
  {
    "id": "pattern-power-gap",
    "version": "0.2",
    "name": "权力差压缩表达空间",
    "definition": "识别“权力差压缩表达空间”时，只使用对话中的行为、次数、条件和后续反应，不把单次事件写成人格本质。",
    "observable_signals": [
      "对话出现与“权力差压缩表达空间”相关的明确行为",
      "用户或对方给出可核对的条件、次数或影响"
    ],
    "counterexamples": [
      "对方在得到新信息后停止或调整",
      "双方已明确同意相同规则且可以自由拒绝"
    ],
    "possible_user_impact": [
      "压力或困惑",
      "关系、时间、信用或安全成本"
    ],
    "strategy_refs": [
      "strategy-clarify-intent"
    ],
    "cautions": [
      "先核对上下文和反例",
      "区分事实、感受、推测与未知"
    ],
    "lens": "balanced",
    "risk_level": "none",
    "humor_applicability": "suitable",
    "source_note": "原创模式总结",
    "review_status": "pending_human_review"
  },
  {
    "id": "pattern-value-imbalance",
    "version": "0.2",
    "name": "投入回报持续失衡",
    "definition": "识别“投入回报持续失衡”时，只使用对话中的行为、次数、条件和后续反应，不把单次事件写成人格本质。",
    "observable_signals": [
      "对话出现与“投入回报持续失衡”相关的明确行为",
      "用户或对方给出可核对的条件、次数或影响"
    ],
    "counterexamples": [
      "对方在得到新信息后停止或调整",
      "双方已明确同意相同规则且可以自由拒绝"
    ],
    "possible_user_impact": [
      "压力或困惑",
      "关系、时间、信用或安全成本"
    ],
    "strategy_refs": [
      "strategy-clarify-intent"
    ],
    "cautions": [
      "先核对上下文和反例",
      "区分事实、感受、推测与未知"
    ],
    "lens": "balanced",
    "risk_level": "none",
    "humor_applicability": "suitable",
    "source_note": "原创模式总结",
    "review_status": "pending_human_review"
  },
  {
    "id": "pattern-words-actions-gap",
    "version": "0.2",
    "name": "承诺与行动不一致",
    "definition": "识别“承诺与行动不一致”时，只使用对话中的行为、次数、条件和后续反应，不把单次事件写成人格本质。",
    "observable_signals": [
      "对话出现与“承诺与行动不一致”相关的明确行为",
      "用户或对方给出可核对的条件、次数或影响"
    ],
    "counterexamples": [
      "对方在得到新信息后停止或调整",
      "双方已明确同意相同规则且可以自由拒绝"
    ],
    "possible_user_impact": [
      "压力或困惑",
      "关系、时间、信用或安全成本"
    ],
    "strategy_refs": [
      "strategy-clarify-intent"
    ],
    "cautions": [
      "先核对上下文和反例",
      "区分事实、感受、推测与未知"
    ],
    "lens": "balanced",
    "risk_level": "none",
    "humor_applicability": "suitable",
    "source_note": "原创模式总结",
    "review_status": "pending_human_review"
  },
  {
    "id": "pattern-reasonable-clarification",
    "version": "0.2",
    "name": "合理澄清和必要询问",
    "definition": "识别“合理澄清和必要询问”时，只使用对话中的行为、次数、条件和后续反应，不把单次事件写成人格本质。",
    "observable_signals": [
      "对话出现与“合理澄清和必要询问”相关的明确行为",
      "用户或对方给出可核对的条件、次数或影响"
    ],
    "counterexamples": [
      "对方在得到新信息后停止或调整",
      "双方已明确同意相同规则且可以自由拒绝"
    ],
    "possible_user_impact": [
      "压力或困惑",
      "关系、时间、信用或安全成本"
    ],
    "strategy_refs": [
      "strategy-clarify-intent"
    ],
    "cautions": [
      "先核对上下文和反例",
      "区分事实、感受、推测与未知"
    ],
    "lens": "balanced",
    "risk_level": "none",
    "humor_applicability": "suitable",
    "source_note": "原创模式总结",
    "review_status": "pending_human_review"
  },
  {
    "id": "pattern-normal-feedback",
    "version": "0.2",
    "name": "具体正常反馈",
    "definition": "识别“具体正常反馈”时，只使用对话中的行为、次数、条件和后续反应，不把单次事件写成人格本质。",
    "observable_signals": [
      "对话出现与“具体正常反馈”相关的明确行为",
      "用户或对方给出可核对的条件、次数或影响"
    ],
    "counterexamples": [
      "对方在得到新信息后停止或调整",
      "双方已明确同意相同规则且可以自由拒绝"
    ],
    "possible_user_impact": [
      "压力或困惑",
      "关系、时间、信用或安全成本"
    ],
    "strategy_refs": [
      "strategy-clarify-intent"
    ],
    "cautions": [
      "先核对上下文和反例",
      "区分事实、感受、推测与未知"
    ],
    "lens": "balanced",
    "risk_level": "none",
    "humor_applicability": "suitable",
    "source_note": "原创模式总结",
    "review_status": "pending_human_review"
  },
  {
    "id": "pattern-mutual-negotiation",
    "version": "0.2",
    "name": "双方协商并形成规则",